text,category
Meditation and yoga can improve mental health,Health
"Fruits, whole grains and vegetables helps control blookd pressure",Health
These are the latest fashin trends for this week,Fashion
Vibrant color jeans fr male are becoming a trend,Fashion
The concert starts at 7 PM tonight,Event
Navaratri dandiya program at Expo center in Mumbai this october,Event
Exiciting vacation destinations for your next trip,Travel
Maldives and Srilanka are gaining populatiry in terms of low budget vacation places,Travel
